[
  {
    "id": "karpathy__nanoGPT",
    "name": "nanoGPT",
    "repo_url": "https://github.com/karpathy/nanoGPT",
    "author": "Andrej Karpathy",
    "author_developer_id": "karpathy",
    "description": "The simplest, fastest repository for training/finetuning medium-sized GPTs",
    "category": "llm-edu",
    "tags": ["gpt", "training", "education", "minimal-code"],
    "language": "Python",
    "stars": 59400,
    "stars_history": [{ "date": "2026-06-10", "stars": 59400 }],
    "why_interesting": "『最小可读实现』教学范式的代表作，从零理解 GPT 训练的最佳入口",
    "discovered_at": "2026-06-10",
    "source": "关注开发者动态",
    "status": "shortlisted",
    "my_take": "做培训产品 demo 的标准范式参照。",
    "replicate_intent": "build"
  },
  {
    "id": "karpathy__nanochat",
    "name": "nanochat",
    "repo_url": "https://github.com/karpathy/nanochat",
    "author": "Andrej Karpathy",
    "author_developer_id": "karpathy",
    "description": "The best ChatGPT that $100 can buy — 全栈训练+推理一套带走",
    "category": "llm-edu",
    "tags": ["chatgpt", "full-stack", "training", "education"],
    "language": "Python",
    "stars": 54800,
    "stars_history": [{ "date": "2026-06-10", "stars": 54800 }],
    "why_interesting": "$100 预算从零训练一个可用 ChatGPT，端到端理解 LLM 产品的最短路径",
    "discovered_at": "2026-06-10",
    "source": "关注开发者动态",
    "status": "shortlisted",
    "my_take": "",
    "replicate_intent": "build"
  },
  {
    "id": "karpathy__llm-c",
    "name": "llm.c",
    "repo_url": "https://github.com/karpathy/llm.c",
    "author": "Andrej Karpathy",
    "author_developer_id": "karpathy",
    "description": "LLM training in simple, raw C/CUDA",
    "category": "llm-edu",
    "tags": ["c", "cuda", "training"],
    "language": "C",
    "stars": 30200,
    "stars_history": [{ "date": "2026-06-10", "stars": 30200 }],
    "why_interesting": "去掉所有框架依赖的 LLM 训练，理解底层的极致样本",
    "discovered_at": "2026-06-10",
    "source": "关注开发者动态",
    "status": "feed",
    "my_take": "",
    "replicate_intent": "watch"
  },
  {
    "id": "karpathy__micrograd",
    "name": "micrograd",
    "repo_url": "https://github.com/karpathy/micrograd",
    "author": "Andrej Karpathy",
    "author_developer_id": "karpathy",
    "description": "A tiny autograd engine with a PyTorch-like neural network library",
    "category": "llm-edu",
    "tags": ["autograd", "education", "minimal-code"],
    "language": "Python",
    "stars": 16200,
    "stars_history": [{ "date": "2026-06-10", "stars": 16200 }],
    "why_interesting": "百行级自动求导引擎，『Zero to Hero』系列的教学基石",
    "discovered_at": "2026-06-10",
    "source": "关注开发者动态",
    "status": "feed",
    "my_take": "",
    "replicate_intent": "watch"
  },
  {
    "id": "chopratejas__headroom",
    "name": "headroom",
    "repo_url": "https://github.com/chopratejas/headroom",
    "author": "chopratejas",
    "author_developer_id": null,
    "description": "Compress tool outputs, logs, files, and RAG chunks before they reach the LLM. 60-95% fewer tokens, same answers. Library, proxy, MCP server",
    "category": "agent-infra",
    "tags": ["context-engineering", "token", "mcp", "rag"],
    "language": "Python",
    "stars": 20630,
    "stars_history": [{ "date": "2026-06-10", "stars": 20630 }],
    "why_interesting": "本周 Trending 第一（周增 15k star）：context 压缩是 agent 时代的硬需求，省 60-95% token",
    "discovered_at": "2026-06-10",
    "source": "github-trending-weekly",
    "status": "feed",
    "my_take": "",
    "replicate_intent": "watch"
  },
  {
    "id": "mvanhorn__last30days-skill",
    "name": "last30days-skill",
    "repo_url": "https://github.com/mvanhorn/last30days-skill",
    "author": "mvanhorn",
    "author_developer_id": null,
    "description": "AI agent skill that researches any topic across Reddit, X, YouTube, HN, Polymarket, and the web — then synthesizes a grounded summary",
    "category": "skill",
    "tags": ["skill", "research", "osint", "claude-code"],
    "language": "Python",
    "stars": 37438,
    "stars_history": [{ "date": "2026-06-10", "stars": 37438 }],
    "why_interesting": "今日 Trending 第一（日增 3.2k star）：单个 skill 文件做跨平台调研，与本站每日采集需求直接相关",
    "discovered_at": "2026-06-10",
    "source": "github-trending-daily",
    "status": "shortlisted",
    "my_take": "和我的 deep-research 工作流高度互补，作者值得进推荐池。",
    "replicate_intent": "fork"
  },
  {
    "id": "Panniantong__Agent-Reach",
    "name": "Agent-Reach",
    "repo_url": "https://github.com/Panniantong/Agent-Reach",
    "author": "Panniantong",
    "author_developer_id": null,
    "description": "Give your AI agent eyes to see the entire internet. Read & search Twitter, Reddit, YouTube, GitHub, Bilibili, XiaoHongShu — one CLI, zero API fees",
    "category": "agent-infra",
    "tags": ["cli", "scraping", "agent", "中文开发者"],
    "language": "Python",
    "stars": 25595,
    "stars_history": [{ "date": "2026-06-10", "stars": 25595 }],
    "why_interesting": "周增 4.4k star：一个 CLI 让 agent 免 API 读全网（含 B站/小红书），中文开发者作品",
    "discovered_at": "2026-06-10",
    "source": "github-trending-weekly",
    "status": "shortlisted",
    "my_take": "本站模块3/4 采集器的候选基建，作者值得关注。",
    "replicate_intent": "fork"
  },
  {
    "id": "Leonxlnx__taste-skill",
    "name": "taste-skill",
    "repo_url": "https://github.com/Leonxlnx/taste-skill",
    "author": "Leonxlnx",
    "author_developer_id": null,
    "description": "Gives your AI good taste. Stops the AI from generating boring, generic slop",
    "category": "skill",
    "tags": ["skill", "design", "anti-slop"],
    "language": "Shell",
    "stars": 39597,
    "stars_history": [{ "date": "2026-06-10", "stars": 39597 }],
    "why_interesting": "周增 7.8k star：『给 AI 品味』成为一个赛道，skill 形态的爆款样本",
    "discovered_at": "2026-06-10",
    "source": "github-trending-weekly",
    "status": "feed",
    "my_take": "",
    "replicate_intent": "watch"
  },
  {
    "id": "lfnovo__open-notebook",
    "name": "open-notebook",
    "repo_url": "https://github.com/lfnovo/open-notebook",
    "author": "lfnovo",
    "author_developer_id": null,
    "description": "An Open Source implementation of Notebook LM with more flexibility and features",
    "category": "ai-app",
    "tags": ["notebooklm", "knowledge", "open-source-alternative"],
    "language": "TypeScript",
    "stars": 28595,
    "stars_history": [{ "date": "2026-06-10", "stars": 28595 }],
    "why_interesting": "周增 4.2k star：NotebookLM 开源平替，知识库+播客生成，可私有化",
    "discovered_at": "2026-06-10",
    "source": "github-trending-weekly",
    "status": "feed",
    "my_take": "",
    "replicate_intent": "watch"
  },
  {
    "id": "Open-LLM-VTuber__Open-LLM-VTuber",
    "name": "Open-LLM-VTuber",
    "repo_url": "https://github.com/Open-LLM-VTuber/Open-LLM-VTuber",
    "author": "Open-LLM-VTuber",
    "author_developer_id": null,
    "description": "Talk to any LLM with hands-free voice interaction, voice interruption, and Live2D talking face running locally across platforms",
    "category": "digital-human",
    "tags": ["vtuber", "live2d", "voice", "digital-human"],
    "language": "Python",
    "stars": 10734,
    "stars_history": [{ "date": "2026-06-10", "stars": 10734 }],
    "why_interesting": "周增 2.6k star：本地运行的 LLM 数字人（语音打断 + Live2D），与数字人『小安』业务直接相关",
    "discovered_at": "2026-06-10",
    "source": "github-trending-weekly",
    "status": "shortlisted",
    "my_take": "捷安数字人方向的开源对照样本，值得拆方案。",
    "replicate_intent": "fork"
  },
  {
    "id": "affaan-m__ECC",
    "name": "ECC",
    "repo_url": "https://github.com/affaan-m/ECC",
    "author": "affaan-m",
    "author_developer_id": null,
    "description": "The agent harness performance optimization system. Skills, instincts, memory, security, and research-first development for Claude Code, Codex, Opencode, Cursor and beyond",
    "category": "agent-infra",
    "tags": ["harness", "claude-code", "skills", "memory"],
    "language": "JavaScript",
    "stars": 211924,
    "stars_history": [{ "date": "2026-06-10", "stars": 211924 }],
    "why_interesting": "21 万 star、周增 9k：agent harness 优化的现象级项目，与我的 Harness 学习线对口",
    "discovered_at": "2026-06-10",
    "source": "github-trending-weekly",
    "status": "feed",
    "my_take": "",
    "replicate_intent": "watch"
  },
  {
    "id": "NousResearch__hermes-agent",
    "name": "hermes-agent",
    "repo_url": "https://github.com/NousResearch/hermes-agent",
    "author": "Nous Research",
    "author_developer_id": null,
    "description": "The agent that grows with you",
    "category": "agent",
    "tags": ["agent", "memory", "personalization"],
    "language": "Python",
    "stars": 188871,
    "stars_history": [{ "date": "2026-06-10", "stars": 188871 }],
    "why_interesting": "18.9 万 star、周增 1.2 万：『随用户成长的 agent』，个性化记忆方向的头部项目",
    "discovered_at": "2026-06-10",
    "source": "github-trending-weekly",
    "status": "feed",
    "my_take": "",
    "replicate_intent": "none"
  },
  {
    "id": "pbakaus__impeccable",
    "name": "impeccable",
    "repo_url": "https://github.com/pbakaus/impeccable",
    "author": "Paul Bakaus",
    "author_developer_id": null,
    "description": "The design language that makes your AI harness better at design",
    "category": "skill",
    "tags": ["design", "harness", "ai-design"],
    "language": "JavaScript",
    "stars": 36814,
    "stars_history": [{ "date": "2026-06-10", "stars": 36814 }],
    "why_interesting": "周增 3.3k star：给 AI coding 配设计语言，前 Google 开发者关系负责人出品",
    "discovered_at": "2026-06-10",
    "source": "github-trending-weekly",
    "status": "feed",
    "my_take": "",
    "replicate_intent": "watch"
  },
  {
    "id": "phuryn__pm-skills",
    "name": "pm-skills",
    "repo_url": "https://github.com/phuryn/pm-skills",
    "author": "phuryn",
    "author_developer_id": null,
    "description": "PM Skills Marketplace: 100+ agentic skills, commands, and plugins — from discovery to strategy, execution, launch, and growth",
    "category": "skill",
    "tags": ["pm", "skills", "product-management"],
    "language": "",
    "stars": 13461,
    "stars_history": [{ "date": "2026-06-10", "stars": 13461 }],